user_prompt,유형,극성,시제,확실성
"동탄역에는 GTX(수도권광역급행철도) A노선을 비롯해 인덕원~동탄선, 신분당선 연장선, 동탄도시철도(트램) 등도 계획돼 있다.",사실형,긍정,미래,불확실
바르자마자 잘 스며들어 끈적임이나 번들거림 없이 피부가 매끄럽고 촉촉해져야 꾸준히 사용할 수 있다.,추론형,긍정,미래,불확실
게임산업 현안과 윤석열 정부의 게임 정책에 대한 전략 및 기본틀 확립을 위한 논의가 예정됐으며 제21대 국회 후반기 국회의장으로 선출될 김진표 의원과 문화체육관광부 박보균 장관이 참석해 축사할 예정이다.,예측형,긍정,미래,불확실
문제는 이 다음이다.,추론형,긍정,미래,확실
따라서 한 시간마다 자리에서 일어나 제자리걸음을 하는 것만으로도 혈관 탄성이 좋아지고 각종 혈관성 질환의 위험을 크게 낮출 수 있다.,사실형,긍정,미래,불확실
"라이브 월드의 ＇신석샵＇에서 음양 육성을 지원하는 아이템인 ＇고속성장 이용권＇, ＇음양 전용 의천 신공패＇, ＇음양 전용 두악 비공패＇, ＇음양 전용 천곤팔찌 1단계＇ 등을 0신석(무료)에 획득할 수 있다.",사실형,긍정,미래,불확실
정부가 제시한 중산층 소득 범위 최고액의 최소 1.5배는 돼야 국민들의 중산층 기준에 근접할 수 있다.,사실형,긍정,미래,불확실
"KB국민·신한·하나·우리·IBK기업, NH농협은행 등 6대 은행은 7월 4~25일 박람회 홈페이지를 통해 서류전형 신청을 접수하고, 서류전형 통과자에게 8월 24일과 25일 박람회 현장면접 기회를 제공한다.",예측형,긍정,미래,확실
"올해는 메종 마리끌레르, 월간미술, 아트인컬처, 아트나우 등 미술 잡지, 미술재료 전문회사 홀베인, 한국화랑협회 소속 미술품감정위원회도 부스를 꾸민다.",사실형,긍정,미래,확실
"병원에 전달된 후원금은 방호복, 마스크, 손세정제 등의 부족으로 어려움을 겪고 있는 현장 의료진들의 방역 물품을 지원하는 데 우선적으로 쓰이며 환자 치료를 위한 의료 기기 구비 및 확산 방지를 위해 노력하는 의료진 활동 등에 사용될 예정이다.",사실형,미정,미래,불확실
16일 격전의 아제로스 패치 ＇느조스의 환영＇ 적용공격대 던전 ＇깨어난 도시 나이알로스＇ 등장 ＇예고＇    오는 16일 ＇월드오브워크래프트: 격전의 아제로스＇의 최종 콘텐츠인 ＇느조스의 환영＇이 추가된다.,사실형,긍정,미래,확실
이에 따라 2019년 9월 기준 월 52만5018원(특례·분할연금 제외)인 노령연금 전체 월평균 수령액은 이달 25일부터 2100원(52만5018원 × 0.4%) 올라 52만7118원이 된다.,사실형,긍정,미래,확실
강풍 주의 표지판 준수고속도로 위험지역에는 방풍벽이 설치되어 있다.,사실형,긍정,미래,확실
남의 나라 독립선언 250주년 준비를 이렇게 자세히 소개하는 건 그 과정에서 양국 관계를 증진할 우리의 역할이 있을 듯해서다.,추론형,긍정,미래,불확실
"＇휴식＇, ＇외출＇, ＇양호실＇을 선택하거나 육성 과정에서 적성의 ＇스킬＇을 획득할 수도 있다.",사실형,미정,미래,불확실
카페 내 이벤트 게시판에 해산물이 들어간 음식 사진 또는 게임 내 요리 콘텐츠 화면을 등록하면 게임재화 ＇사이다＇ 100개가 제공한다.,사실형,긍정,미래,확실
"노지랑골 사거리에서 몰고리재를 연결하는 이 길은 너덜구간, 숲길이 반복되는데, 노간주나무 고목, 조릿대 군락지 등을 지날 수 있다.",사실형,긍정,미래,불확실
팬덤이 계속 유지가 될 수 있도록 단순한 등기 권리증 역할을 넘어 NFT 소유자들을 위한 혜택을 만들어가는 것도 중요하다.,추론형,미정,미래,불확실
이에 따라 여행사나 항공사가 소액 외국환 매매 신청 등을 대리하거나 백화점 등 유통업체가 소액 대출을 중개하는 업무가 가능해질 것으로 전망된다.,예측형,긍정,미래,불확실
"상업용 비행 분야에서 자동 조종 기술은 오래전부터 존재했으나, 심현철(David Shim) 카이스트 항공우주공학 교수에 의하면 헬기 조종사들은 일자리를 제일 먼저 잃은 직군이 될 것이다.",예측형,긍정,미래,확실
증오심을 유발하는 데 올인하지 말고 희망을 보여주는 ＇vote for hope＇를 유도해야 하는 이유다.,추론형,긍정,미래,확실
"우락부락한 몸에 소의 머리를 지닌 투로족, 고대 문명의 힘을 간직한 강력한 골렘, 가넬의 폭군에 밀려 척박한 땅으로 떠난 베디르·아히브 등 새롭고 흥미진진한 이야기와 전투가 펼쳐진다.",사실형,긍정,미래,확실
지난 12일 교섭에서 결렬을 한 번 초래한 요인이기도 하고 자칫 이번 총파업과 유사한 노동계 투쟁의 불씨가 될 수 있다.,추론형,미정,미래,불확실
31일 국세청에 따르면 비주거용 부동산에 상속·증여세를 부과할 때 외부 전문 감정평가 기관의 감정가액으로 재산을 평가할 수 있게 된다.,사실형,긍정,미래,확실
지난달 28일부터 전직원 대상의 순차 특별 유급휴가를 시작한 스마일게이트도 4일부터 2차 유급휴가를 진행하고 추가로 3월 15일까지 법인별로 부서 상황에 맞춰 재택근무를 시행하기로 결정했다.,사실형,긍정,미래,확실
"채권 만기는 내년 1월로, 이를 상환하지 못하면 디폴트 위기를 맞게 된다.",사실형,긍정,미래,확실
수유동 수유래미안 전용 59㎡는 한때 매매가가 3억원대 후반에 그쳤지만 최근 호가가 4억6000만원을 넘나든다.,사실형,긍정,미래,확실
학교 측은 조 전 장관의 교수직 직위해제 여부를 판단하기에는 통보 내용이 부족하다며 추가 자료를 요청할 계획이다.,사실형,긍정,미래,확실
"통상적으로 전염병이 누그러드는 데 1~3개월이 걸리는데, 한 달 정도 안에 마무리된다면 단기 충격 정도에 끝날 수 있다.",추론형,긍정,미래,불확실
"실제 스윙과 최대한 비슷한 물리 효과를 구현하는 9축 3D 스윙 센서를 이용해 페블비치, 세인트 앤드루스, 파인허스트, 울프 크릭 등 총 23개의 유명 코스를 실감나게 라운드해 볼 수 있다.",사실형,긍정,미래,불확실
"그라비티 유튜브 채널, 공식 커뮤니티와 연계한 이벤트도 진행한다.",사실형,긍정,미래,확실
또 캐롯은 보장 기간 종료 후 단기 질병안심보험 관련 정산이익(사차익) 발생시 전액 감염병 관리기관에 기부할 예정이다.,사실형,긍정,미래,확실
미세먼지 농도는 전 권역이 ＇좋음＇∼＇보통＇ 수준을 보이겠다.,예측형,긍정,미래,불확실
학비도 싸고 능력이 되면 정규 대학에 진학할 자격도 주어진다.,사실형,긍정,미래,불확실
"주문량이 늘면 향후 경기를 낙관해 기계, 운송장비, 통신장비 등 구입을 늘린다는 것.",사실형,긍정,미래,확실
3명의 이용자가 팀을 이뤄 최대 150명까지 참여 가능한 전장에서 생존 경쟁을 펼칠 수 있다.,사실형,긍정,미래,불확실
＇기생충＇ 드라마에는 봉 감독이 책임 프로듀서로 참여할 예정이다.,사실형,긍정,미래,불확실
전문가들은 만약 한국에서 유행하는 독감 바이러스가 북한에 퍼지면 사망자가 속출할 것이라고 말할 정도다.,사실형,긍정,미래,확실
국토부는 안전운임제를 내년 이후에도 계속 시행하고 후속 논의를 지속해서 이어나갈 방침이다.,사실형,긍정,미래,확실
1월 한달간은 스타벅스커피쿠폰(3만명)을 추가 제공한다.,사실형,긍정,미래,확실
혼란한 경쟁이 소강상태에 접어들면 시장에서 살아남는 사업자는 손에 꼽을 정도가 되지 않을까 소비자 편의성과 신뢰성을 얼마나 확보하느냐가 향후 시장의 판도를 가를 것이다.,예측형,긍정,미래,확실
프리미엄 영입 및 이벤트 영입으로 슈퍼스타 등급의 트레이너를 획득하지 못하면 슈퍼스타 확정 게이지가 상승하고 확정 게이지가 가득 차면 슈퍼스타 등급 이상의 트레이너를 확정적으로 영입할 수 있다.,추론형,긍정,미래,불확실
산단가는 지난 5월 0원에서 1.23원으로 인상된 데 이어 7월뿐 아니라 10월에도 1.9원에서 2.3원으로 0.4원 더 오른다.,사실형,긍정,미래,확실
그러나 이들 숫자는 현재 고등학교나 대학에 다니고 있는 영재 수의 절반에도 미치지 못할 것으로 예상된다.,예측형,긍정,미래,불확실
NH투자증권은 최근 달러당 원화가치 하락 역시 LG이노텍에 추가 이익을 가져다줄 것으로 봤다.,사실형,긍정,미래,불확실
이후 금투세 유예 기간이 종료되는 2025년부터는 금투세를 시행한다는 게 정부의 계획이다.,사실형,긍정,미래,확실
＂대사이자 경험이 많은 멘토로 말씀을 드리자면 실패 없는 창조와 혁신은 없다는 것입니다.＂,추론형,미정,미래,불확실
정부가 고유가 대응을 위해 7월부터 연말까지 유류세 인하 폭을 30%에서 37%까지 확대한다.,사실형,긍정,미래,확실
코로나19는 그에게 결정적인 힘이 될 것이다.,추론형,긍정,미래,확실
제주도에서 렌터카를 이용할 때도 2박을 예약하면 1박을 무료로 사용할 수 있다.,사실형,긍정,미래,확실
그런데 과연 푸드테크협의회에서 대기업과 스타트업 간 협력이 가능할까.,대화형,미정,미래,불확실
정식 출시 시점에는 베타 서비스 형태로 PC 버전을 운영한다.,사실형,긍정,미래,확실
"고양 창릉지구, 부천 대장지구는 내년부터 토지 보상이 시작될 전망이다.",예측형,긍정,미래,불확실
전라 서해안 지역은 이날 새벽부터 아침 사이 산발적으로 눈이 내리거나 빗방울이 떨어질 전망이다.,예측형,긍정,미래,불확실
박정희 전 대통령 암살 이후 우왕좌왕하는 권력자들을 블랙코미디 형식으로 그린 임상수 감독의 영화 ＇그때 그 사람들＇(2005)을 재미있게 봤다면 ＇스탈린이 죽었다!＇의 유머코드에도 쉽게 적응할 수 있을 것이다.,추론형,긍정,미래,불확실
운영자 학생이 졸업하고 나면 같은 학교 후배에게 역할을 넘긴다.,사실형,긍정,미래,확실
이에 따라 1회 이용 한도를 기존 1만원에서 5만원으로 상향해 이용자 편의성을 높일 방침이다.,예측형,긍정,미래,불확실
열린민주당이 뜰수록 선거는 조국 대 반조국 프레임으로 흐를 가능성이 높다.,추론형,긍정,미래,불확실
반도체 업체 넥스트칩이 내달 1일 코스닥 상장을 위해 16일부터 이틀 간 기관투자자 대상 수요예측을 진행한다.,사실형,미정,미래,확실
문제는 ＇영재를 범재로 만들기＇ 교육의 폐해가 저출산으로 더욱 심화될 수 있다는 것이다.,추론형,미정,미래,불확실
정권이 검찰 인사와 직제개편으로 권력 수사를 차단한 상태에서 사법부마저 권력을 견제하지 못하면 대한민국을 떠받치는 민주적 기본질서와 법치주의는 무너질 수밖에 없다.,사실형,긍정,미래,확실
카카오게임즈는 시즌2 업데이트 사전예약에 참가한 이용자에게 한정판 ＇앨리스 코스튬＇을 선물하고 매일 자정부터 새벽 2시 사이에 접속하는 이용자들에게는 ＇레드다이아＇ 1000개를 지급한다.,사실형,긍정,미래,확실
세인트루이스의 스프링캠프는 플로리다주 주피터의 로저딘 셰보레 스타디움에 차려진다.,사실형,긍정,미래,확실
러시아의 우크라이나 침공 영향으로 사료값이 올라 힘든 상황에 아예 사료 공급마저 끊기면 치명적인 타격을 입을 수 있다는 우려가 나온다.,추론형,긍정,미래,불확실
그러면서 ＂임금 경로를 통한 물가 상승 압력은 앞으로 점차 커질 가능성이 있다＂고 내다봤다.,사실형,긍정,미래,불확실
이로 인해 금융 소비자 편익이 한 단계 더 제고될 전망이다.,예측형,긍정,미래,불확실
문재인정부도 시 주석 방한 문제로 한국이 국가적 품위를 잃지 않게 처신해야 한다.,추론형,긍정,미래,확실
이래저래 농협금융지주는 새 농협중앙회장이 온 후 한동안 뒤숭숭해질 공산이 크다.,추론형,긍정,미래,확실
"순수하게 만든 만큼 천연비누로는 세안, 샴푸는 물론 설거지도 할 수 있다.",사실형,긍정,미래,불확실
올해 13회를 맞는 MBN건강미박람회는 ＇브라보 앵콜 라이프＇를 슬로건으로 삼고 시니어를 위한 다양한 정보를 제공할 예정이다.,예측형,긍정,미래,불확실
그래도 사회의 역동성을 회복하려면 가계에 희망을 불어넣어야 한다.,추론형,긍정,미래,확실
"또한, KC-330은 오는 14일 개최되는 한미 안보협의회의(ROK-US Security Consultative Meeting, SCM) 참석하는 우리 대표단(단장 서욱 국방장관)을 태우고 태평양을 건너갈 예정이다.",사실형,미정,미래,불확실
최강 연맹전에 참가하지 않는 이용자들도 지지하기를 통해 특정 국가를 응원할 경우 지지한 국가의 최종 순위에 따라 국가대전 주화를 보상으로 받을 수 있다.,사실형,긍정,미래,불확실
"한미약품 연구센터를 비롯해 현대트렌시스, 아신제약 등 4500여개 기업 입주가 예정돼 있다.",사실형,긍정,미래,불확실
"최고속도는 마하 1.8, 시속으로 표현하면 2200Km/h이며, 항속거리는 2,900Km로서 한 번 이륙해서 서울과 제주를 3회 왕복할 수 있다.",추론형,긍정,미래,확실
"안정제나 수면제를 투여한 반려동물도 탑승할 수 없는데, 운송 중 체온과 혈압이 떨어져 위험할 수 있어서다.",사실형,긍정,미래,확실
미국 외 국가 매출도 ＇오스카 후광＇을 입고 점프할 것으로 보인다.,추론형,긍정,미래,불확실
"업계 관계자들에 따르면 노사 간 물밑 대화는 오가고 있으나, 양측의 입장 차가 커 파업은 끝없이 길어질 전망이다.",예측형,긍정,미래,확실
해골병사는 자신의 머리 ＇해골(스컬)＇을 교체해 사실상 새로운 캐릭터로 변신할 수 있다.,추론형,긍정,미래,불확실
기본적으로 스컬은 두 개를 선택할 수 있으며 게임 진행 도중 교체할 수 있다.,추론형,긍정,미래,불확실
펄어비스는 3월 3주차 점검 전까지 봄맞이 핫타임 이벤트도 실시한다.,사실형,긍정,미래,확실
행안부 외청으로 독립돼 있는 경찰 조직 특성상 행안부 장관은 국가경찰위에 안건 부의·재의요구권을 통해 간접적으로만 치안 사무에 관여할 수 있다.,사실형,긍정,미래,확실
구조조정이 본격화하면 실직 태풍은 불가피하다.,사실형,긍정,미래,확실
가동을 중지했다가 재개하는 데만 최대 2주일이 걸린다.,사실형,긍정,미래,확실
물론 건전성이나 전산 역량 등 일정한 자격을 갖춘 핀테크 사업자에게만 결제망을 개방할 것으로 예상된다.,사실형,긍정,미래,확실
중국은 미국의 바이러스 비상사태 추이를 지켜보면서 약속 이행 여부를 저울질할 것으로 보인다.,예측형,긍정,미래,확실
어린애들까지 1인당 10만원씩 나눠 쓴다고 과연 얼마나 소비 진작 효과가 생길까.,대화형,미정,미래,불확실
관람객 사전 방문 신청은 MBN건강미박람회 홈페이지에서 하면 된다.,사실형,긍정,미래,확실
우승을 차지해야 도쿄올림픽 출전권을 따낼 수 있다.,사실형,긍정,미래,불확실
산모가 격리 해제되기전까지 신생아와의 접촉은 피해야 한다.,추론형,긍정,미래,확실
가입기간 내 금리가 오를 경우 가입기간 기준 12개월 주기가 도래할 때 해당 금리를 적용한다.,사실형,긍정,미래,불확실
또 이들 기관은 17일부터 박람회를 위한 홈페이지를 개설해 금융권 상시 채용정보 플랫폼으로 운영한다.,예측형,긍정,미래,확실
해경이 작성한 초동 수사 자료와 고인 동료들의 진술 조서도 공개하도록 했다.,사실형,긍정,미래,확실
텐트 밖은 유럽 출연진은 배우로만 섭외를 하였는데 이전 삼시 세 끼에서도 좋은 모습을 보여준 유해진과 예능에서 얼굴을 자주 보여준 윤군상 그리고 영화에서 탑 조연으로 새롭게 뜨고 있는 진선규와 박지환 배우로 총 4명의 배우들이 출연을 하게 된다.,사실형,긍정,미래,확실
민간의 자율이나 기업 활동을 크게 저해하는 규제는 대통령이 직접 나서서 단숨에 혁파하겠다는 것이다.,사실형,긍정,미래,확실
연동형 비례제로 소수 정당이 난립하면 복잡하고 다양한 이해관계가 생기기 때문에 갈등이 더 심해지고 정국이 불안정해질 수도 있습니다.,대화형,긍정,미래,불확실
"GVC에 의존하는 한국기업에 제2, 제3의 와이어링 하니스는 얼마든지 나올 수 있다.",추론형,긍정,미래,불확실
"신 중심의 중세 시대에서 인간 중심의 합리적 사고로 변화한 르네상스 시대에 지성와 이성, 영혼, 사랑, 죽음 등 인간 존재에 대해 깊이 탐구했던 화가들의 작품과 통찰을 만나볼 수 있다.",사실형,긍정,미래,확실
두 기업 중 한쪽의 8개 사업 부문을 매각해야 나머지 부분에서 합병이 진행될 수 있다는 것이다.,추론형,긍정,미래,불확실
해당 인플루언서들의 방송은 유튜브 또는 게임 내 ＇릴레이 기부 챌린지＇ 이벤트 페이지를 통해 시청할 수 있으며 시청자에게도 각 방송별로 각종 아이템이 제공된다.,사실형,긍정,미래,확실
전문가들은 당분간 미아뉴타운을 중심으로 강북구 집값 상승세가 이어질 것으로 내다본다.,사실형,긍정,미래,확실
이후 재조합기술을 활용해 단일클론항체치료제 개발에 돌입할 계획이다.,사실형,긍정,미래,확실
최대 8인의 전투부대를 구성해 지옥성물함 공격대 우두머리에 도전할 수 있으며 150명으로 구성된 클랜을 통해 대규모 PvP 콘텐츠인 ＇투쟁의 굴레＇를 즐길수도 있다.,추론형,미정,미래,불확실
투자자들은 판매사들이 고객 반대를 무시하고 가입을 시켰다거나 사모펀드라는 사실을 알리지 않았다며 이달 줄소송을 예고하고 있다.,사실형,긍정,미래,확실
＂그래서 콘텐츠에 힘이 생기고 팬덤이 만들어지는 겁니다.＂,대화형,긍정,미래,확실
"결국 국내 은행들은 상대적으로 손쉬운 이자 장사에만 다시 몰두할 것이고, 외국인 투자자들은 한국 금융사를 더 이상 쳐다보지 않을 것이다.",예측형,부정,미래,불확실
"유류세 탄력세율 인하 조치에 따라 다음달 1일부터 휘발유 1ℓ에 붙는 유류세는 516원, 경유 369원, 액화석유가스(LPG) 부탄은 130원까지 내려간다.",사실형,긍정,미래,확실
더 큰 문제는 게임에 대한 부정적인 인식이 더욱 확산될 수 있다는 점이다.,추론형,긍정,미래,확실
8월말에는 7일 격리를 유지할 때보다 8.3배 많은 14만1000명으로 급증한다.,사실형,긍정,미래,불확실
"또 토론토의 눈 덮인 뉴퀸 스트리트, 맨해튼 미드타운의 번화가 등 새로운 장소들도 등장하며 대칭형 전장 중앙의 로봇을 장악해 적진에 진격시키는 신규 모드 푸쉬(Push) 게임 모드도 만날 수 있다.",예측형,긍정,미래,불확실
국내 물가가 지난해 10월 3%대(3.2%)를 돌파하면서 고공행진을 시작했다는 점에 비춰보면 오는 9월까지 5%대 고물가 상황이 이어질 가능성이 크다.,추론형,긍정,미래,불확실
올해는 자격을 갖춘 41명 중 34명만 나서 경쟁을 펼친다.,사실형,긍정,미래,확실
"리더가 되고자 하는 사람에게 명상(meditation)은 외부로 뻗어있는 의식을 내면으로 향하게 하며, 스스로에 대한 성찰과 영감을 얻을 수 있는 최선의 선택이 될 수 있다.",추론형,긍정,미래,확실
특별한 사정변경이 없는 한 내년 1월1일자로 감면조치가 종료된다.,사실형,긍정,미래,불확실
"하지만 모든 부품, 소재를 한국에서 만들 수는 없다.",사실형,부정,미래,확실
투자은행(IB) 업계에서도 소부장 기업에 대한 상장 특례가 자리 잡으면서 향후 관련 기업의 증시 입성이 늘어날 것으로 전망하고 있다.,예측형,긍정,미래,불확실
대통령이 의장을 맡는 정부 규제혁신 최고결정기구인 ＇규제혁신전략회의＇가 신설된다.,사실형,긍정,미래,확실
"각종 숨은 규제는 일괄 정비하고, 정책 재조정을 통해 공공부문의 과도한 시장 개입도 최소화한다.",사실형,긍정,미래,확실
3일 금융당국과 금융권에 따르면 금융위원회는 핀테크 기업이 은행과 제휴하지 않고 직접 계좌를 개설할 수 있도록 하는 가칭 ＇종합지급결제업＇ 도입을 올해 추진한다.,사실형,긍정,미래,확실
헝가리 부다페스트에 가면 국회의사당을 등지고 다뉴브 강물을 바라보는 깡마른 남자 동상을 볼 수 있다.,사실형,긍정,미래,확실
"의학계 입장에서는 게임이 중독물질이고, ＇게임이용장애＇가 질병이어야만 관련 역할이 생기고, 그 과정에서 적지 않은 돈이 의학계로 흘러 들어가게 된다.",사실형,긍정,미래,확실
＇2020 신년음악회＇가 오는 8일 오후 7시 예술의전당 음악당 콘서트홀에서 열린다.,사실형,긍정,미래,확실
중요 ＇덩어리 규제＇는 대통령이 직접 회의를 주재해 과감하고 신속하게 문제를 해소하겠다는 것이다.,사실형,긍정,미래,확실
3분기에는 스테이블코인 ＇위믹스 달러＇ 프로토콜 도입 및 위믹스 디파이 서비스도 시작한다.,사실형,긍정,미래,불확실
기부금은 신종 코로나바이러스 확산으로 피해를 입은 우한지역 지원을 위해 사용할 예정이다.,사실형,긍정,미래,불확실
한일 관광산업이 직면한 문제의 해법을 한일 협력에서 찾아보는 것은 어떨까.,대화형,미정,미래,불확실
"최대 에다나 주화 4300개, 광원석 파편 1만4000개, 태고 등급 ＇룬＇을 획득할 수 있다.",사실형,긍정,미래,불확실
힘든 여건에도 전시장을 찾은 관람객들을 위해 추첨을 통해 장욱진 등 대가 판화와 소품을 14명(21일과 23일 각 7명 추첨)에게 경품으로 선물할 예정이다.,사실형,긍정,미래,확실
쿠르츠 대표가 총리에 취임하면 전 세계 최연소 정부 수반 타이틀도 넘겨받게 된다.,사실형,긍정,미래,불확실
전작 ＇미르4＇의 성과를 뛰어넘는 것은 물론 오랫동안 흥행 성과를 유지한다는 목표다.,사실형,긍정,미래,불확실
＂＇디지털 미디어렙(광고매체 판매 대행사)＇을 넘어 ＇넘버원 디지털 마케팅 플랫폼 기업＇으로 도약할 것이다.＂,사실형,미정,미래,불확실
이렇게 확보한 카드는 정규전과 야생전 덱에 모두 사용할 수 있다.,사실형,긍정,미래,불확실
"여기에 새로운 애완동물과 탈것이 추가돼 무아르(마우트), 아퀴르 둥지새끼(테크리스), 라킴(테크리스), 공허의 자취가 남은 아누비사스(약탈당한 자 라덴) 등을 획득할 수도 있다.",사실형,긍정,미래,불확실
땀냄새의 원인 물질인 피지 오염을 제거해 의류에 배인 냄새까지 깔끔하게 제거한다.,사실형,긍정,미래,확실
"5월에는 인천-프랑크푸르트 노선을 5월28일부터 주 4회에서 주 5회로 증편하고, 인천-런던 노선 역시 5월30일부터 주 2회에서 주 3회로 증편한다.",사실형,미정,미래,확실
KT 클라우드는 지난 4월 분사 후 마련되는 스마트테크 코리아 무대를 민간의 잠재적 고객들과 만나 교감하는 장으로 적극 활용할 계획이다.,예측형,긍정,미래,확실
입장료 8000원을 내면 관람 후에 리아프가든센터에서 다육식물이나 꽃 등과 교환해주기 때문에 공짜로 구경한 기분으로 식물원을 나설 수 있다.,추론형,긍정,미래,확실
특히 첫날인 7월 14일 오전 10시 개최되는 개막식 행사에 참여하는 관람객에게는 선착순 경품 추첨 이벤트에 참여할 수 있는 기회를 제공한다.,예측형,긍정,미래,확실
아울러 서울시는 정비구역으로 지정된 지 40년이 지난 마포로5구역의 정비계획을 재정비해 충정로와 서소문로 간 도로를 연계할 계획이다.,사실형,긍정,미래,확실
