user_prompt,output,유형,극성,시제,확실성
"문학계 ＇성공한＇ 편집자이기도 한 그는 500권 넘는 책을 손수 꿰맸고, 세계와 문학의 간극을 좁히기에 게으른 적 없다.","사실형,부정,과거,확실",사실형,부정,과거,확실
마이너리그 강등 거부권을 계약에서 넣어 빅리그 입성이 유력한 김광현은 아직 보직을 확정하지 않았다.,"사실형,부정,과거,확실",사실형,부정,과거,확실
산업 태동기라는 당시 시대상을 감안하더라도 정부가 게임이 지닌 생산성에 대해서는 이렇다 할 고찰을 갖고 있지 않은 시기였다.,"사실형,부정,과거,확실",사실형,부정,과거,확실
기부자는 지금까지 자신의 이름과 얼굴을 단 한번도 공개하지 않았다.,"사실형,부정,과거,확실",사실형,부정,과거,확실
하지만 언관들이 반발해 성사되지는 못했다.,"사실형,부정,과거,확실",사실형,부정,과거,확실
세정제가 남아 있는 편의점은 거의 없었다.,"사실형,부정,과거,확실",사실형,부정,과거,확실
"통상 연말·연초가 되면 금융권에서 고금리 특판 상품을 내놓기도 했지만, 올해는 그마저도 찾기 어려웠다.","사실형,부정,과거,확실",사실형,부정,과거,확실
"A씨는 법정에서 ＂단순한 폭언 내지 답답하고 억울한 감정의 표현에 불과할 뿐, 협박의 고의가 없었다＂고 주장했으나 법원은 이를 받아들이지 않았다.","사실형,부정,과거,확실",사실형,부정,과거,확실
"앞서 이 회사는 2014년 두 차례, 2016년에도 한 차례 매각을 추진했지만 실패한 바 있다.","사실형,부정,과거,확실",사실형,부정,과거,확실
상승기에 매물도 희소해 정말 원하던 로열층도 아니었다.,"사실형,부정,과거,확실",사실형,부정,과거,확실
무협 관계자는 ＂안전운임도 부담이 나날이 증가하지만 기업들은 할증으로 인한 부담이 더 크다＂며 ＂안전운임위원회가 화물연대에 ＇기울어진 운동장＇이어서 할증의 근거를 명확히 밝히라고 요구해도 받아들여지지 않는다＂고 했다.,"사실형,부정,과거,확실",사실형,부정,과거,확실
어차피 정리를 하지 않는 내 물건들에 정해진 자리는 없었다.,"사실형,부정,과거,확실",사실형,부정,과거,확실
"공군의 제트 전투기 시대를 연 F-86이 주력이었던  60년대 초에 졸업한 공사 8기생 105명 생도 가운데, 25명이 조종 특기를 부여 받았으나, 최종적으로 조종사로 선발된 인원은 20명을 넘지 못했다.","사실형,부정,과거,확실",사실형,부정,과거,확실
이 단지는 2018년 준공한 입주 5년 차 새 아파트인 데다 1304가구 대단지인데도 한파를 피하지 못했다.,"사실형,부정,과거,확실",사실형,부정,과거,확실
내가 원산을 지나다가 명태 더미를 보았는데 한강에 쌓인 땔나무처럼 많아 숫자를 헤아릴 수 없었다.,"사실형,부정,과거,확실",사실형,부정,과거,확실
훗날 임기를 마치고 새벽 일찍 김안로 집에 가서 인사를 청하는데 김안로는 대꾸조차 하지 않았다.,"사실형,부정,과거,확실",사실형,부정,과거,확실
사람됨이 이러했으니 《좌계부담》은 그를 나쁘게 평하지 않는다.,"사실형,부정,과거,확실",사실형,부정,과거,확실
"병법의 활용, 장수 선발, 군사 훈련 등의 정비는 논의조차 못 했다.","사실형,부정,과거,확실",사실형,부정,과거,확실
트럼프 대통령 탄핵 심판이 상원에서 진행 중이지만 민주당 탄핵소추단은 단 한 명의 증인도 추가로 채택하지 못했다.,"사실형,부정,과거,확실",사실형,부정,과거,확실
ICE 웹사이트가 아닌 크립토 데이터 플랫폼 스큐(Skew)에 따르면 백트 옵션은 지난 10일 간 거래되지 않았다.,"사실형,부정,과거,확실",사실형,부정,과거,확실
조선시대에는 흉년 등으로 기근이 끊이지 않았다.,"사실형,부정,과거,확실",사실형,부정,과거,확실
정부는 상병수당 도입을 위한 재원 마련 계획을 구체화하지 못했다.,"사실형,부정,과거,확실",사실형,부정,과거,확실
"우유곽을 잘라 속옷 상자로 변신시키고, 옷걸이를 프라이팬 거치대로 바꿔 작은 공간에도 더 많은 물건을 넣을 수 있도록 알려주는 그들의 ＇금손＇을 나는 도저히 따라할 수 없었다.","사실형,부정,과거,확실",사실형,부정,과거,확실
그러나 공수처는 이 같은 주장을 받아들이지 않았다.,"사실형,부정,과거,확실",사실형,부정,과거,확실
이명박정부에서도 당시 한나라당(국민의힘 전신)과 정부가 유류세를 50%까지 내릴 수 있도록 합의하기도 했으나 법률은 개정되지 않았다.,"사실형,부정,과거,확실",사실형,부정,과거,확실
하멜이 보기에 조선인들의 해외에 대한 지식은 태국을 벗어나지 못한다고 했다.,"사실형,부정,과거,확실",사실형,부정,과거,확실
포식자 캐릭터는 ＇기생충＇의 박 사장이 처음이 아니었다.,"사실형,부정,과거,확실",사실형,부정,과거,확실
관찰사가 맛있게 먹고 물고기 이름이 무엇인지 물었으나 아무도 알지 못했다.,"사실형,부정,과거,확실",사실형,부정,과거,확실
기존에는 일반심사 중에 통합 심사로 전환하는 것이 불가능했다.,"사실형,부정,과거,확실",사실형,부정,과거,확실
물론 수당을 더 주는 일은 없었다.,"사실형,부정,과거,확실",사실형,부정,과거,확실
"《산림경제》는 술을 마신 뒤 냉수나 냉차를 마시면, 신장에 냉독이 들어가 좋지 않다고 했다.","사실형,부정,과거,확실",사실형,부정,과거,확실
다만 연평균 5.8%씩 증가한 미국(29만4250명)과 3.5%씩 증가한 캐나다(2만9802명 엔 미치지 못했다.,"사실형,부정,과거,확실",사실형,부정,과거,확실
굽거나 국을 끓이더라도 고약한 냄새가 사라지지 않았다.,"사실형,부정,과거,확실",사실형,부정,과거,확실
"한편 헌법재판소는 지난달 26일 음주운전이나 음주측정 거부 전력이 있는 운전자가 다시 범행을 저지를 경우 가중처벌하도록 한 도로교통법 제148조의2 제1항이 위헌이라고 결정, 윤창호법은 효력을 잃었다.","사실형,부정,과거,확실",사실형,부정,과거,확실
당시 정부는 에너지 절약과 낭비 방지 차원에서 신규 전자유기장 허가를 내주지 않았다.,"사실형,부정,과거,확실",사실형,부정,과거,확실
넥슨(대표 이정헌)이 매년 개최하는 국내 최대 게임 지식공유 행사 ＇넥슨개발자콘퍼런스(NDC)＇가 신종 코로나바이러스 감염증(코로나19) 우려에 잠정 연기됐다.,"사실형,부정,과거,확실",사실형,부정,과거,확실
괴산읍사무소는 이 노인을 수소문했으나 신원을 알아내지 못했다.,"사실형,부정,과거,확실",사실형,부정,과거,확실
퇴직 후에도 한국방재협회 회장을 지내는 등 토목과 인연을 놓지 않았다.,"사실형,부정,과거,확실",사실형,부정,과거,확실
"1970년은 강남 개발이 한창이던 시기로, 봉은사 당시 주지는 사찰 소유이던 땅을 판매 거부했다.","사실형,부정,과거,확실",사실형,부정,과거,확실
"깃대가 휘어질 정도로 불어닥친 강풍 속에서도 미국여자프로골프(LPGA) 투어 13년 차 베테랑 박희영(33, 이수그룹)은 집중력이 흐트러지지 않았다.","사실형,부정,과거,확실",사실형,부정,과거,확실
이로써 간첩 활동이 중단돼 명나라 구원병이 도착했다는 정보가 왜군에 들어가지 않았다.,"사실형,부정,과거,확실",사실형,부정,과거,확실
"연봉이 1억원을 넘는 근로자의 환급액은 평균 276만원에 이르렀고, 이들 가운데 1123명은 결정세액이 없어 근로소득세를 물지 않았다.","사실형,부정,과거,확실",사실형,부정,과거,확실
제품을 개발하면서 가장 힘들었던 점은 대체 의약품의 경우 현행법상 건강기능식품으로밖에 허가가 나지 않는다는 사실이었다.,"사실형,부정,과거,확실",사실형,부정,과거,확실
그간 골든글로브는 아시아 콘텐츠에 대한 관심이 크지 않았다.,"사실형,부정,과거,확실",사실형,부정,과거,확실
결과적으로 10만 양병설은 조선이 망할 때까지 구현되지 못한다.,"사실형,부정,과거,확실",사실형,부정,과거,확실
하지만 이때만 해도 이 회장 진영은 마음 편하게 웃을 수 없었다.,"사실형,부정,과거,확실",사실형,부정,과거,확실
묘족 군대도 겁에 질려 쉽게 나서지 못했다.,"사실형,부정,과거,확실",사실형,부정,과거,확실
"요즘에는 기능성을 인정받은 제품을 광고를 통해 알릴 수 있게 되었지만, 당시에는 아예 광고도 할 수 없었다.","사실형,부정,과거,확실",사실형,부정,과거,확실
21대 영조는 긴 통치 기간만큼이나 많은 글씨를 남겼지만 솜씨는 빼어나다고 할 수 없다.,"사실형,부정,과거,확실",사실형,부정,과거,확실
행정소송 1심 판결이 나왔지만 아직 모든 소송이 정리된 것은 아니다.,"사실형,부정,과거,확실",사실형,부정,과거,확실
기생충은 이날 각본상과 감독상 후보에도 이름을 올렸으나 수상으로 연결되지는 않았다.,"사실형,부정,과거,확실",사실형,부정,과거,확실
그래도 진짜 내 집에 들어간다며 인테리어 구상에 들떴던 그는 지난해 12·16 부동산대책이 본인에게 어떤 영향을 미칠지 가늠하지 못했다.,"사실형,부정,과거,확실",사실형,부정,과거,확실
혹시 우리 지역에 감염자가 살고 있지 않을까 하는 마음에 링크를 클릭했지만 별다른 정보를 얻을 수 없었다.,"사실형,부정,과거,확실",사실형,부정,과거,확실
영등포구 내에서도 당산동은 전통 부촌인 여의도나 재개발 사업이 활발한 영등포동과 달리 주거지역으로 이름을 널리 알리지는 않았다.,"사실형,부정,과거,확실",사실형,부정,과거,확실
전시에서 탁영은 두 형의 책문만 대신 지어주고 자기 것은 짓지 않았다.,"사실형,부정,과거,확실",사실형,부정,과거,확실
49건은 현재 중재부 구성 등 절차가 진행 중이며 4건은 2019년 이전에 판매된 차량에 대한 것이어서 중재 절차가 진행되지 않았다.,"사실형,부정,과거,확실",사실형,부정,과거,확실
PC온라인게임과 달리 짧은 수명 탓에 중소규모 기업이 오래 버티기도 힘들었다.,"사실형,부정,과거,확실",사실형,부정,과거,확실
경상우수사 원균은 많은 배를 거느리고 있었지만 멀리서 왜군이 부산에 상륙하는 것을 쳐다볼 뿐 아무 일도 하지 못했다.,"사실형,부정,과거,확실",사실형,부정,과거,확실
이후로도 장시간 사이트 접속이 원활하지 않았다.,"사실형,부정,과거,확실",사실형,부정,과거,확실
또 수술실 CCTV를 도입한 이후 지금까지 촬영녹화된 영상물 사본을 요청한 사례는 한 건도 없었다.,"사실형,부정,과거,확실",사실형,부정,과거,확실
당시 심리학자들은 ＂인간은 자신의 행동을 스스로 창출하는 존재가 아니라 환경적 상황에서 행동목록을 습득해 온 유기체＂에 불과하다는 스키너의 주장에 동조하지 않았다.,"사실형,부정,과거,확실",사실형,부정,과거,확실
첫 홀에서는 퍼터가 필요 없었다.,"사실형,부정,과거,확실",사실형,부정,과거,확실
둔촌주공 재건축 조합은 지난 2월 말부터 HUG와 일반분양가 사전 협의를 해왔으나 절충점을 찾지 못했다.,"사실형,부정,과거,확실",사실형,부정,과거,확실
손흥민은 활발히 움직였지만 결정적인 기회는 한 번도 없었다.,"사실형,부정,과거,확실",사실형,부정,과거,확실
