user_prompt,output,유형,극성,시제,확실성
"애써 오를 만한 산은 아니지만, 일생에 한 번은 가봐야 할 수행의 산길이라 할 수 있다.","사실형,미정,현재,불확실",사실형,미정,현재,불확실
"그러나 최근에는 표적치료제의 등장으로 전이성 유방암 치료 성적이 크게 개선됐으며, 5년 이상의 장기 생존 역시 기대할 수 있게 됐다.","사실형,미정,현재,불확실",사실형,미정,현재,불확실
경찰은 박 씨가 앞서 달리던 화물차를 제대로 보지 못해 사고가 난 것으로 보고 있다.,"사실형,미정,현재,불확실",사실형,미정,현재,불확실
여기에 한정된 코스트 내에서 별도 능력 ＇렙톤＇을 착용해 전략을 고도화할 수 있다.,"사실형,미정,현재,불확실",사실형,미정,현재,불확실
정 대표는 ＂세계적으로 사망률이 높은 만성질환인 뇌졸중에 대한 예방제 외에 삶의 질을 높여 주는 치매·알츠하이머 치료제 연구에도 성과를 높이겠다＂고 말했다.,"사실형,미정,현재,불확실",사실형,미정,현재,불확실
다른 쪽에 전시된 친환경 데이터센터 솔루션 부스에선 단순히 냉각수를 활용해왔던 기존 시스템보다 50% 에너지 절감 효과를 볼 수 있다고 했다.,"사실형,미정,현재,불확실",사실형,미정,현재,불확실
"이용자는 다른 세계 명마들의 이름과 영혼을 이어받아 꼬리와 귀, 초인적인 주력을 가진 ＇우마무스메＇와 함께 이들을 트레이닝하는 교육 기관 ＇트레센 학원＇의 신인 트레이너의 역할을 맡아 많은 ＇우마무스메＇의 목표인 ＇트윙클 시리즈＇에 활약하기 위해 고군분투하는 이야기를 경험할 수 있다.","사실형,미정,현재,불확실",사실형,미정,현재,불확실
